{"$schema":"https://json-schema.org/draft/2020-12/schema","type":"object","additionalProperties":false,"required":["scenario_version","id","learner_request","fresh_profile","expected_operations","required_properties","prohibited_properties"],"properties":{"scenario_version":{"const":1},"id":{"type":"string"},"learner_request":{"type":"string"},"fresh_profile":{"const":true},"expected_operations":{"type":"array","minItems":1},"required_properties":{"type":"array","minItems":1},"prohibited_properties":{"type":"array","minItems":1}}}
